{
  "schema_version": "P1008_T2_ANNOTATED_DISPLAY_V1",
  "display_state": "ANNOTATED_RESEARCH_KPI",
  "candidate_id": "T2C-E2E8617A2EFC04E3-643F507A8188",
  "candidate_hash": "44838A41BD825DD53D5C5F4559D1C6212B6A7C87019A670109AB6921AFBA905E",
  "approval_id": "T2APP-44838A41BD825DD5-99D63D9DB764",
  "metric_id": "TEST_ESTIMATED_PB_MULTIPLE",
  "metric_name": "Synthetic estimated price-to-book multiple",
  "period": "2026-09-18",
  "use_scope": "REPORT_KPI_TABLE",
  "display_label_zh": "\u63a8\u4f30\u503c",
  "display_text_zh": "Synthetic estimated price-to-book multiple\uff08\u63a8\u4f30\uff091.800\u20132.050 MULTIPLE\uff08\u9ede\u4f30 1.905\uff1b\u975e\u516c\u53f8\u76f4\u63a5\u63ed\u9732\uff1b\u4fe1\u5fc3\uff1a\u4e2d\uff1b\u57fa\u790e/\u5047\u8a2d\uff1aP1008_TEST_ESTIMATED_PB_PRICE_DIV_BVPS TEST_ONLY_V1\uff1bTEST_ONLY estimated BVPS is used solely to exercise the T2 contract.\uff09",
  "point_estimate": "1.905",
  "estimate_lower_bound": "1.800",
  "estimate_upper_bound": "2.050",
  "unit": "MULTIPLE",
  "confidence": "MEDIUM",
  "confidence_label_zh": "\u4e2d",
  "basis_assumptions_summary_zh": "P1008_TEST_ESTIMATED_PB_PRICE_DIV_BVPS TEST_ONLY_V1\uff1bTEST_ONLY estimated BVPS is used solely to exercise the T2 contract.",
  "not_directly_disclosed": true,
  "disclosure_zh": "\u975e\u516c\u53f8\u76f4\u63a5\u63ed\u9732",
  "data_tier": "T2_ESTIMATED_DERIVED",
  "owner_approved_for_annotated_use": true,
  "formal_authority": false,
  "formal_scoring_eligible": false,
  "formal_publish_eligible": false,
  "research_only": true,
  "actionable": false
}
